Songs_title,lyrics,link,duble_check
아이유 - unlucky,"기 기 쓰고를를해야하는 건 아냐 아냐
하루 하루는 정도하지하지 않아도 괜찮아
그럼 그럼 역시에도에도 하군 나의 여인 여인 음

여전히 여전히 한 무수이 있지 있지
끝없이 끝없이 듯 헤맬
풀리지 풀리지 얄미운 않는 사이로

마치 마치가
잘 잘 장난 짜여진
달릴수록 달릴수록 달아나

그냥 인생, 우리는 여전히 운이 없으면 좋다
길 길 잃어도을을 또각또각 또 가볍게 걸어 걸어
(천천히하세요)
옳지 않아요
슬퍼지고 슬퍼지고 않아서
화내는지도 화내는지도

여전히 여전히 한 무수이 있지 있지
이번 이번도에 듯 해 해
아주 아주 한 사소 사소 하나의 차이로로

마치 마치가
삐뚤은 삐뚤은 같아
도망쳐도 도망쳐도로 여기

우리는 여전히 운이없는 삶입니다
비틀 비틀 계속 거려도 똑바르게 걸어 걸어
(천천히하세요)
옳은 때론 right right가 외로운지도 몰라는 없습니다
지워지고 지워지고 않아서
악쓰는지 악쓰는지 몰라

(Lalala la la I love ma days)
나는 때때로 인생이 너무 의미가 있다는 것을 알고 있습니다
(Lalala la la I love ma days)
그건 진실이야.그래서 저는 노력하고 있습니다

난 난의 나으로 갈게 갈게
불안 불안 돌아보면서 해
별 별없이 큰일 언제나처럼처럼
이번 이번도에 볼 볼 게 음

우리는 여전히 운이 없으면 여전히 시원합니다
길 길 잃어도을을 또각또각 또 가볍게 걸어 걸어
옳지 않아요
어쩌면 어쩌면대로 나름 느림보 같은 같은
지금 지금 괜찮은지도 이대로",https://www.youtube.com/watch?v=3hrHjHiEfuM,IU unlucky Lyrics (아이유 unlucky 가사) [Color Coded Lyrics/Han/Rom/Eng]
신용재 (2F) - 오늘,"햇살 햇살 떠밀려서에 눈 눈을 들고
어제 어제 똑같은와을
다시 다시하는 시작
거리 거리 저에
무슨 무슨에 생각 있을까
저마다 저마다 고민의에에 다들 힘들까
해 해 떠도가 내 내 아침은
앞선 앞선에 걱정 않는 길 길
내 내 잘가 있을까
이게이게 길 내 맞을까
되뇌고 되뇌고 풀리지 되돌려도
숱 숱 생각들
내 내 잘 게있다 고 고
누군 누군 말가 준다면
어제 어제 나아질 보단 보단 만 같아 오늘이이
지친 지친을 몸 집 집으로 돌아오는
복잡한 복잡한 거리이에서
표정 표정 걷는없이
시끄러운 시끄러운에 소리은
바빠져 바빠져
깜빡이 깜빡이 신호는는 마저 나를 재촉해 재촉해
해 해지면가 더 외로워져 외로워져
오늘 오늘 나의의 들어줄 사람이 없어 없어
내 내 잘가 있을까
이게이게 길 내 맞을까
되뇌고 되뇌고 풀리지 되돌려도
숱 숱 생각들
내 내 잘 게있다 고 고
누군 누군 말가 준다면
어제 어제 나아질 보단 보단 만 같아 오늘이이
괜찮은 괜찮은이 듯
혼자 혼자 오늘 참았던
결국 결국로 눈물 버릴 버릴 것 같아
나 나 더도하고 싶어 싶어
나 나 행복도 싶어
이런 이런 꼭 날 줘
그 그라도 누구 싶어
내일 내일 다은 거 거 라 고
누군 누군 말가 준다면
어제 어제 나아질 보단 보단 만 같아 오늘이이",https://www.youtube.com/watch?v=ZNmmVjpzyr0,신용재 I 신용재 - 오늘 LIVE
폴킴 - 오늘 밤,"모두 모두 밤 잠든
또 또 찾아오네 어김없이
우울 우울 밤 해지는
그저 그저 생각 멍하니 해 요 요
혼자인 혼자인 만 것 날이면이면
눈물 눈물 나이
아마 아마 이겠죠
이미 이미 내 지나온에
항상 항상 항상 외롭고
항상 항상 항상 힘들고 해
변해 변해이 버린 모습이이
익숙지는 익숙지는 요
항상 항상 항상 외롭고
항상 항상 또 힘들고 속상 해 해
내일 내일 괜찮아질은 야
가득 가득이 찬 잔 만 만
내 내 것 벗인 같아서
한참 한참 바라보고
말 말 걸어도 비워 비워 내 요
항상 항상 항상 외롭고
항상 항상 항상 힘들고 해
변해 변해이가는 모습이이
반갑지는 반갑지는 요
항상 항상 항상 외롭고
항상 항상 또 힘들고 속상 해 해
내일 내일 괜찮아질은 야
또 또
항상 항상 또 힘들고 속상 해 해
내일 내일 괜찮아질은 라 라 믿을뿐
나 나 오늘도는",https://www.youtube.com/watch?v=B2rYVs4YPhM,폴킴 (Paul Kim) - 오늘 밤 [Official Video] [Revised]
볼빨간사춘기 - 나의 사춘기에게,"나 나 한때는는가이 세상에에
사라지길 사라지길
온 온 너무나 세상이 해
매일 매일을 밤 날
차라리 차라리가 내
마음 마음 편할까
모두 모두 날가 시선이
너무나 너무나
아름답게 아름답게
그 그을 시절 아파서
사랑 사랑 수받을
내 내 너무나가
엄마 엄마 아빠는 다
나 나 바라보는데
내 내은 마음 게 아닌데 아닌데
자꾸만 자꾸만 만 멀어
어떡 어떡 어떡 해 해 어떡 해 어떡 해 해
시간 시간 약이 말이이
내 내 정말 게
하루가 하루가 지날수록
더 더
근데 근데은 가끔 행복하면하면
또 또 봐
내 내 가진가 행복들을을
누군 누군가가 봐
아름다운 아름다운
그 그이 기억 아파서
아픈 아픈 아파만큼
사라지지 사라지지 않아서
친구들 친구들 사람들은 다
나 나 바라보는데
내 내은 모습 게 아닌데 아닌데
자꾸만 자꾸만 만 멀어
그래도 그래도 어쩌면
내 내이가에
밝은 밝은이라도 빛 봐
어쩌면 어쩌면 모든 그을
내딛 내딛라도
짧게 짧게을 빛 볼까 봐 봐
포기 포기 수가 할
하루도 하루도 편히 맘 맘 수가 없던 내가가
이렇게 이렇게 일어서라도하면
내 내 날가 봐
아아아아아아아 아아아아아아아
아아아아아아아 아아아아아아아
얼마나 얼마나 아팠을까
얼마나 얼마나 아팠을까
얼마나 얼마나 얼마나 얼마나",https://www.youtube.com/watch?v=GY_StGcBSYw,볼빨간사춘기 - 나의 사춘기에게 [유희열의 스케치북/You Heeyeol’s Sketchbook] | KBS 220603 방송
아이유 - 에필로그,"나 나 알게를 기뻤는지
나 나 사랑를 좋았었는지
우릴 우릴 불렀던 위해 노래들이이
여전히 여전히가 위로

당신 당신이이 질문들에에
‘대답’고 그렇다 해 준다면
그것 그것으로 만 만되는 나의 삶이란이란
오 오, 의미 충분히 있지 요

내 내에 맘 맘 의문이 없어 난 난
이렇게 이렇게 요
어디 어디도에에 어느 곳 에나 있겠죠 있겠죠
가능 가능 믿어 하리라

짧지 짧지 나와 않은 기억들이이
조금은 조금은을 당신하는지
삶 삶 어느의의에 우리가 함께 였음이 였음이
여전히 여전히이 자랑

멋쩍은 멋쩍은 모든이에
‘대답’고 그렇다 해 준다면
그것 그것으로 만 만되는 나의 삶이란이란
오 오, 어찌나 모르겠죠 바라던 결말 결말인지 요

내 내에 맘 맘 의문이 없어 난 난
이이으로 다음
툭툭 툭툭 보면 살다 살다 또 만나게 될 거예요예요
그러리 그러리 믿어라고

이이에 밤 미련이 미련이 없어 난
깊은 깊은에 잠 요
어떤 어떤을 꿈 꿈 들려줄 날 오겠지 요 요
들어줄 들어줄 지 거?",https://www.youtube.com/watch?v=c9E2IT1jHQY,[MV] IU(아이유)_Epilogue(에필로그)
잔나비 - 슬픔이여안녕,"이젠 이젠 잊어 다 걸
아니 아니 잃어 다
답 답 쫓아을
질문 질문두고을
돌아서던 돌아서던 이었어

집 집 돌아가에
나 나 어떤는 지을까
슬픔 슬픔 손은
오는 오는가는 건지
저 저에 어디쯤있을있을 텐 데

“젊은 젊은 봐 친구 야 야
잃어버린 잃어버린은 것들 그 그 자리에
가끔 가끔 돌아 뒤은
슬픔 슬픔 슬픔 아는 피어 피어- ""

나 나 나는 미워하고하고
그런 그런가 내 좋아지고
자꾸만 자꾸만는
행복 행복 단어들이란
몸서리 몸서리 적도 친 요

“젊은 젊은 봐 친구 야 야
잃어버린 잃어버린은 것들 그 그 자리에
가끔 가끔 돌아 뒤은
슬픔 슬픔 슬픔 빛 피어 피어“

“손 손 봐을 흔들잖아 흔들잖아
슬픔 슬픔 안녕- 우우- ""

바람 바람 눈 불었고 날렸고
한 한 꽃 계절 피웠고 피웠고 안녕 안녕

구름 구름 하늘 하얗고
한 한 나 시절 자랐고 자랐고 안녕 안녕",https://www.youtube.com/watch?v=cjGNu9qlLGY&pp=ygUe7J6U64KY67mEIC0g7Iqs7ZSU7J207Jes7JWI64WV,잔나비 [JANNABI] - '슬픔이여안녕' (Live from Monkey Fortress Studios)
김필 - 그때 그 아인,"길었던 길었던 그림 하루
아직도 아직도을 아픔 일까
말 말 기다려없이
쓰러질 쓰러질 내 듯와 안기는데 안기는데
마음 마음 얹힌에 기억은은
쏟아낸 쏟아낸로 눈물 지울 지울 수 없어
어디 어디부터 서 할까
허탈한 허탈한 만 웃음
가슴 가슴 박힌에 한 기억 기억
나 나 비웃듯를가는 얼굴들 얼굴들
잡힐 잡힐 멀리 듯을 뻗으면 뻗으면
달아나 달아나 조각난 듯의 꿈들만 꿈들만
두 두 길 갈래 만난 듯 듯
멍하니 멍하니을 한참보다
무언 무언 나가 이끌던
목소리 목소리 한참에 돌아보면
지나온 지나온 순간 모든 어린
슬픔 슬픔 간직 만 채 채 커 버렸구나
혼자서 혼자서 그 잠들었을도
아픔 아픔 간직을 채
시간 시간 벌써은를 키우고 키우고
세상 세상으로 앞 나가 나가 보라 고
어제 어제 나의 내 내 게 묻겠지
웃을 웃을 행복만큼 것 것 같냐 고
아직 아직 소망이
가득 가득 때 메워질
시간 시간 벌써은를 키우고 키우고
세상 세상으로 앞 나가 나가 보라 고
어제 어제 나의 내 내 게 묻겠지
웃을 웃을 행복만큼 것 것 같냐 고
아주 아주 훗날 먼 그 아인 아인
꿈꿔 꿈꿔 모든 왔던 왔던 가진 거 냐 고 고",https://www.youtube.com/watch?v=mAjsF4UTg8g,[MV] 김필 - '그때 그 아인' ＜이태원 클라쓰(Itaewon class)＞ OST Part.6♪
아이유 - 이름에게,"꿈 꿈도에서 목소리는는
이름 이름 대답 불러도하지 않아 않아
글썽이 글썽이 그는 만 돌아와 돌아와
그 그를 소리 혼자서 들어 들어
깨어질 깨어질이 듯
이번 이번 결코에는 않을 게 게
아득히 아득히 그날 멀어진 두 두 손을
끝없이 끝없이
짙고 짙고 밤 어두운
조용히 조용히 네 사라진을 알아 알아
오래 오래
반드시 반드시를 너 게
보이지 보이지 멀어도
가자 가자 새벽이 끝나는 끝나는 곳으로
어김없이 어김없이 앞 내 내 선 그 아이는는
고개 고개 기어이 숙여도 않아
안쓰러워 안쓰러워을 손 달아나
텅 텅 허공 빈 빈 나 혼자 껴 안아 안아
에어질 에어질이 듯
이번 이번 결코에는 않을 게 게
한참 한참 외로이을 그 그 말을
끝없이 끝없이
짙고 짙고 밤 어두운
영원히 영원히 네 사라진을 알아 알아
오래 오래
반드시 반드시를 너 게
보이지 보이지 멀어도
가자 가자 새벽이 끝나는 곳 곳
수없이 수없이
춥고 춥고 날 모진
조용히 조용히 네 잊혀진을 알아 알아
멈추지 멈추지 게
몇 몇이라도 번
믿을 믿을 없도록 수
가자 가자 새벽이 끝나는 끝나는 곳으로",https://www.youtube.com/watch?v=tANNOmdIwXs,[믿고보는MMA] 울컥감동 주의😭 아이유(IU) - 이름에게 #멜론 #MELON
김필 - 다시 산다면,"바람 바람 날이
해 해 날 저녁
고단한 고단한처럼 새 못한
나 나 어깨의
흔적 흔적 무뎌진 마저 위해
타버린 타버린를 나
길 길 나 잃은 봐
언제 언제 볼라도있는
다가갈 다가갈있는
사람 사람 생각이라 때
모두 모두 버린 사라져 빈 날 날
다시 다시 지금 산다면 여긴 어딜까 어딜까
떠나버리면 떠나버리면 수 잊을
흘러 흘러 날 흘러 본다면
외로움 외로움 그리워질까
그대만 그대만 아는이의 뒷모습 뒷모습
감출수록 감출수록 버린
미쳐 미쳐 후회 버린 남았을 때 때
내 내 불러 이름 수 있니 있니
다시 다시 지금 산다면 여긴 어딜까 어딜까
떠나버리면 떠나버리면 수 잊을
아플 아플 데 텐 그리울 그리울 텐 데
모두 모두 소중 다 텐 데 데
다시 다시 눈물 산다면 말라 버릴까 버릴까
서럽지 서럽지 할 못 날 보내고 보내고
혹시라도 혹시라도 게 늦은
매일매일 매일매일 사랑 다시 텐 데 데
혹시 혹시 게 늦은",https://www.youtube.com/watch?v=4fkgMLM5oNg,다시 산다면
AKMU (악뮤) - 작은별,"밤 밤 어딘가 중의
기도기도가 소리
그건 그건 별의 작은 거 야 야
밤 밤 어딘가 중 중의 고백 소리가가
들려오면
그건 그건 별의 작은 거 야 야
가끔 가끔을 밤하늘
평소 평소 보이지에는 같은 같은 모양의
빛깔이 빛깔이
저 저 인공 게 일까 일까 별 이었으면
좋겠다
눈 눈 안에뿐뿐이지 별은
사라지지 사라지지
나이 나이 먹은를 눈이 눈이 침침 할
뿐뿐
여전히 여전히 빛난대
반짝반짝 반짝반짝 별님 작은 조금 만 만
비춰 비춰
이제 이제 좀 어때 어때 만은 한가 요 요
동쪽 동쪽 서쪽 하늘 둘러 보면 보면
모든 모든은 하늘
날 날있다 향해
내 스타가 당신의 상승하게 해주세요
밤
내 스타가 당신의 상승하게 해주세요
밤
내 스타가 당신의 상승하게 해주세요
밤
내 스타가 당신의 상승하게 해주세요
밤
별님 별님 별님 아름다운도 어쩌면 어쩌면
별님 별님 빛처럼처럼 될 수 있나 요 요
나 나 누군도도의 별이 될 수 있을까 있을까
별님 별님 별님 아름다운 수 만 만
있다면 있다면도 나을내어내어
누군가 누군가 바라보는를
별이 별이 싶네되고
반짝반짝 반짝반짝 별님 작은 조금 만 만
비춰 비춰
이제 이제 좀 어때 어때 만은 한가 요 요
동쪽 동쪽 서쪽 하늘 둘러 보면 보면
모든 모든은 하늘
날 날있다 향해",https://www.youtube.com/watch?v=fkvuORod0OM,작은별 (Little Star)
권진아 - 위로,"세상과 세상과 눈 다른 다른 나를 사랑하는하는
세상과 세상과 맘 다른 다른 나를 사랑하는하는
그런 그런 나 그대가 정말 좋다 좋다
나 나 안아를를하는 그대 그 품이 품이
나 나 잠재우고를를를 쉬게한다
위로 위로하지하려 그대 그대 모습이
나 나 큰에게였다
나 나 어제의 그대가 있고 있고
나 나 오늘의 그대가 있고 있고
나 나 내일의 그대가있다있다
그댄 그댄의 나 다
나와 나와 주려 걸어 그대 그대 모습이
나 나 웃게를를 나를 쉬게한다한다
옆 옆있어에에하는 그대 모습이이
나 나 큰에게였다
나 나 어제의 그대가 있고 있고
나 나 오늘의 그대가 있고 있고
나 나 내일의 그대가있다있다
그댄 그댄의 나 다",https://www.youtube.com/watch?v=kdUe1xZh9N0,권진아(Kwon Jin Ah)-위로(Consolation)/멜로가 체질 OST Part 1
이적 - 그땐 미처 알지 못했지,"그땐 그땐 오랜 아주 이었지

난 난 어리석은 작고 였고

열병 열병 사랑처럼 취해 버리고 버리고

심술 심술 그 궂게을 내팽개쳤지 내팽개쳤지

내 내 버린가 어떠한 어떠한 사랑인지

생애 생애 뜨거운 한번인지

두번 두번 또 다시 않는건지

그땐 그땐 알지 미처

오랜 오랜에 뒤는는 알게 되었지

난 난 어리석었다는 작고을

술 술 취해에에을 향하던 봄날에에

물결 물결 가슴이처럼 거렸지

내 내 버린건가 사랑인지인지

생애 생애 뜨거운 한번인지

두번 두번 또 다시 않는건지

그땐 그땐 알지 미처

오 오가 내 내 버린건 어떠한 사랑인지인지

생애 생애 뜨거운 한번인지

두번 두번 또 다시 않는건지

그땐 그땐 알지 미처 미처 예예 예예예 예 예-",https://www.youtube.com/watch?v=1zTZtz_EeU0,이적 - 그땐 미처 알지 못했지 [가사/Lyrics]
백예린 (Yerin Baek) - 한계,"내 내 내 원가 나의의 모습과 네가가
필요 필요 필요하는로의 모습 모습이 같지 같지가 않다는 것 것
잘못 잘못 건 된 않나 요 요
미안 미안 일 할 않나 요 요
그런데 그런데 또 왜 왜 자꾸 날 몰아세우는 건데 건데
도대체 도대체를 뭐 어떻게 해 해


난 난 난 마디 몇 말과과 몇 번 번의 손짓에에
또 또 개 몇 몇 표정과 흐르는 마음에에
울고 울고 그런 웃는 웃는 한 인간 일뿐인데인데
대체 대체 뭐 내게서 더 더 바라나 요
내 내 줄가가있는 것 그 이상을을
줄 줄 줄 없음 수 미안 해 해해야하는하는 건 이제 요 요 요


달라졌구나 달라졌구나 많이도 참
난 난 그대론데 여전히 달라져 버렸어 버렸어
근데 근데 근데 한 혹시 반대로 생각 생각 해 본 본 적은 없었나 요 요

난 난 난 마디 몇 말과과 몇 번 번의 손짓에에
또 또 개 몇 몇 표정과 흐르는 마음에에
울고 울고 그런 웃는 웃는 한 인간 일뿐인데인데
대체 대체 뭐 내게서 더 더 바라나 요
내 내 줄가가있는 것 그 이상을을
줄 줄 줄 없음 수 미안 해 해해야하는하는 건 이제 요 요 요


빼곡히 빼곡히 의미라 들어선
나에겐 나에겐하기 공허 한
일방성 일방성 무의미의
방랑과 방랑과의 방황


난 난 난 마디 몇 말과과 몇 번 번의 손짓에에
또 또 개 몇 몇 표정과 흐르는 마음에에
울고 울고 그런 웃는 웃는 한 인간 일뿐인데인데
대체 대체 뭐 내게서 더 더 바라나 요
내 내 줄가가있는 것 그 이상을을
줄 줄 줄 없음 수 미안 해 해해야하는하는 건 이제 요 요 요",https://www.youtube.com/watch?v=Vg0foqYOOt8,백예린 (Yerin Baek) '한계' Lyric Video
마크툽 (MAKTUB) - 오늘도 빛나는 너에게,"별빛 별빛 내린이
그 그 속 풍경와 나 나
날 날하는
따뜻하게 따뜻하게
니 니 니 눈빛
영원히 영원히
너로 너로 한 가득
널 널 나
날 날 선물
꿈 꿈 더보다
서로 서로 품의
끝 끝 밤없는 걷자
나 나 모든의의을 다주고 싶어 싶어
내 내 맘이 모두 모두 전하고 싶어
잠들지 잠들지
푸른 푸른
이렇게 이렇게이 밝게을 비춰 비춰
너 너 작은와와을 함께하는 게 게
내 내 큰 가장 가장 인 걸 넌 알까 알까
내 내 속 세상
넌 넌이 빛
지금 지금 그대로 모습 곁 곁에 만
행복 행복 짙은이
어둠이 어둠이 밤
같은 같은 속 맘
같은 같은이 꿈 건
우리 우리 정해진
운명 운명 맞닿은이 야
나 나 모든의의을 다주고 싶어 싶어
내 내 맘이 모두 모두 전하고 싶어
잠들지 잠들지
푸른 푸른
이렇게 이렇게이 밝게을 비춰 비춰
너 너 작은와와을 함께하는 게 게
내 내 큰 가장 가장 인 걸 넌 알까 알까
내 내 속 세상
넌 넌이 빛
지금 지금 그대로 모습 곁 곁에 만
내 내 온 게 게 빛이 눈 부셔도 부셔도
네 네에서 앞 앞 순간도 눈 감지 않아 않아
다가올 다가올
계절 계절 바람도
널 널 못하게
내 내 더가가 사람이되고 싶어 싶어
더 더 널 아름답게을을 수있게
잠들지 잠들지
잠들 잠들없는
바람들 바람들 널이있어
언제 언제 나까지까지와 함께 할거 야 야
내 내 숨결도 마지막거야
내 내 속 세상
넌 넌이 빛
지금 지금 그대로 모습 곁 곁에 만
이렇게 이렇게이 밝게을 비춰 비춰",https://www.youtube.com/watch?v=dmSUBdk4SY4,마크툽 (MAKTUB) - 오늘도 빛나는 너에게(To You My Light)(Feat.이라온) Lyrics Video
선우정아 - 도망가자 (Run With Me),"도망가자
어디 어디 가야 든 것 것 만 같아
넌 넌이라도 금방 것 같아 같아
괜찮아
우리 우리
걱정 걱정 잠시은
대신 대신 짐을 가볍게
실컷 실컷 다시 웃고
거기서 거기서 우리는 생각말자
너랑 너랑 이렇게
손 손 내 내밀면 잡을 게 게
있을까 있을까 게
어디 어디 간다를
우린 우린를 서로 붙잡고 있으니 있으니
너라서 너라서는 나
나 나 봐를 맞춰 줄래 줄래
너 너 너 얼굴의에 빛 빛이 스며들 때까지까지
가가 지금 보자
도망가자
멀리 멀리 가도 안 거 야 야
너 너 함께와 난 난 다 좋아
너 너 맘의의 편할 수있는 곳 곳
그게 그게든지 어디 해 줘 줘
너랑 너랑 이렇게
손 손 내 내밀면 잡을 게 게
있을까 있을까 게
어디 어디 간다를
우린 우린를 서로 붙잡고 있으니 있으니
가보는 가보는 야 거 볼까
어디 어디 어떻게로든
내 내 옆가가 있을게 마음껏 울어도 돼 돼
그 그에
돌아오자 돌아오자
지쳐도 지쳐도 내 돼 안아 줄게 줄게
괜찮아 괜찮아 느려도 좀 걸어도
나 나은 만 만 갈 거 야 어디 든 든
당연 당연 가자 해
사랑 사랑 눈 해 줄래
너 너 너 얼굴의에 빛 빛이 스며들 때까지까지
가가 지금 보자
도망가자",https://www.youtube.com/watch?v=D0l1HdemykU,선우정아(SWJA) - 도망가자 (Run With Me) / 가사(Lyrics)
잔나비 - 주저하는 연인들을 위해,"나 나 읽기는 마음이야이야
당신도 당신도 훑고 스윽 요
달랠 달랠없는 길 마음 있지 있지
머물 머물 가셔 다 음
내 내 긴 게 게을 남겨 줘 요 요
사랑 사랑 사랑을 해 해 줘 요
할 할 있다면 수 수 수 만 있다면
새하얀 새하얀으로 빛 빛 댈 비춰 줄게 요 요
그러다 그러다이 밤
우리 우리의 둘만을을 새겨 요
추억 추억 그 할 할 위에 갈피를 꽂고선 꽂고선
남몰래 남몰래 보아 펼쳐
나 나 자라나는의을
못 못 채 본 버릴 버릴 순 없네
미련 미련 엔 남길바 아픈 아픈 게 나아
서둘러 서둘러 그 안겨본 따스 따스 할 테니
그러다 그러다이 밤
우리 우리의 둘만을을 새겨 요
추억 추억 그 할 할 위에 갈피를 꽂고선 꽂고선
남몰래 남몰래 보아 펼쳐
언젠가 언젠가 그날이 또도
우린 우린 뒤돌지 서둘러 요
마주보던 마주보던 뒷걸음치면서
서로 서로 안녕을의 요
피고 피고 마음지는 알아 요 요
다시 다시 계절도
난 난 동안 한 활짝 활짝 피었다 질래
또 또 영원히
그럼 그럼 내에도은
또 또 꿈 같은 꾸고
그럼 그럼 꾸던에도을
난 난 미루진 또 거 야 야",https://www.youtube.com/watch?v=40vynd0KsHg,새하얀 빛 같은 여운을 남기는 잔나비(JANNABI) '주저하는 연인들을 위해'♬ | 비긴어게인 오픈마이크
잔나비 - 가을밤에 든 생각,"머나먼 머나먼 저 별빛에서도도
노랠 노랠 사랑 부르는
밤 밤 오손도손이면 것들 모아서 모아서
노랠 노랠 부르겠지
새까 새까 밤하늘 만 수놓은 수놓은 별빛 마저
불어오는 불어오는 따라가고
보고픈 보고픈 생각 그대가는
시월 시월 아름다운의 밤에에
부르다 부르다 어제 보면 올까
그립던 그립던이 날 많았는데
저 저 반짝 멀리
아련히 아련히가는
너 너 작은는 같아
작별 인사
멀어져 멀어져
작별 OOH
새까 새까 밤하늘 만 수놓은 수놓은 별빛 마저
불어오는 불어오는 따라 바람
보고픈 보고픈 생각 그대가는
시월 시월 아름다운의 밤에에
수많은 수많은 불어 바람 대도
날려 날려 않을래
잊혀질까 잊혀질까 곁 두려워 맴도는는
시월 시월 아름다운의 밤을을
기억 기억주세요
작별 인사",https://www.youtube.com/watch?v=ROIvbbg8jMQ,잔나비 - 가을밤에 든 생각 / 가사
10CM - 스토커,"나 나 알아도도의 문제가 무엇인지인지
난 난 별 못났고 일 없지 없지
그 그 나 애가 부끄러워 부끄러워한다는 게
슬프 슬프 내지만 뭐라고라고
빛나는 빛나는 갈 누군 일에에
기준 기준있는이라면
이해 이해 수 할 할 할 말없는 걸 걸
난 난 쓴 안경 이니까
내 내 이렇게가하는데
이렇게 이렇게하는데
나 나 아무것는 할 할 수없고
바라 바라 보는데 만
내 내 그렇게가 할까 요 요
내 내 나쁜가 요
아마도 아마도 그 내일도 뒷모습 만 만
이제 이제 나 알아 알아 할 일이 무엇인지인지
다 다하고 포기하지
저 저 나가는 잘 잘의 남자 친구처럼처럼
되고되고지만 싶하지
빛나는 빛나는 갈 누군 일에에
기준 기준있는이라면
이해 이해 수 할 할 할 말없는 걸 걸
난 난 쓴 안경 이니까
내 내 이렇게가하는데
이렇게 이렇게하는데
나 나 아무것는 할 할 수없고
바라 바라 보는데 만
내 내 그렇게가 할까 요 요
내 내 나쁜가 요
아마도 아마도 그 내일도
나 나 왜는는 사람 이런 모습이고이고
이런 이런을 사랑
나 나 아무것는 될 될 수없고
바라 바라 보는데 만
내 내 그렇게가 하니까
내 내 나쁜가니까
아마도 아마도 그 내일도
나 나 알아도도의 문제가 무엇인지인지",https://www.youtube.com/watch?v=IkKCnUdEeNQ,가슴 아픈 짝사랑..10cm - 스토커♬ [유희열의 스케치북/You Heeyeol's Sketchbook] 20191220
