Songs_title,lyrics,link,duble_check
백아 - 테두리,"내 내 그 오늘도 오늘도 담을 말이없는 걸 걸
뜸 뜸들을을 그 댈 추억 하오 하오
늦은 늦은 꺼내서 밤 해
누구 누구위한를 사랑 사랑 노래를
꽃 꽃 정든 남방을 쥐고 쥐고
세상 세상 그대에 울리면 난 난
기억 기억 잃고을 태어난 대도 대도
머무르고 머무르고 떼 싶다 써 요 요
빛 빛 테두리에 그리고
주위 주위 맴도를 난
그 그이 달 게 요 요
내 내 무뎌지지 맘은
익숙해지지만 익숙해지지만 주시오
깊어질수록 깊어질수록 운 슬피도 아닌 아닌
부슬비 부슬비 나처럼 테 요 요
빛 빛 테두리에 그리고
주위 주위 맴도를 난 그 그
그 그이 달 게 요 요
나 나 그대의 비록 비록이 될 순 없지만 없지만
감히 감히 없던 그대을 떠올리느니 떠올리느니
사랑 사랑 아니길
어리숙한 어리숙한 정리 마음 못한
어울리지 어울리지 마음 않는
그 그 바라 댈 내 내가 밉소
왜 왜는 나 마저도 마저도 노력하고
깊어진 깊어진 맘 내 초라해지는 걸 걸
내 내 그 오늘도 오늘도 담을 말이없는 걸 걸",https://www.youtube.com/watch?v=R8axRrFIsFI&pp=ygUS67Cx7JWEIC0g7YWM65GQ66as,백아 (Baek.a) - 테두리
"카더가든 - 그날, 우리","가끔 가끔 돼
유난히 유난히
아무 아무 없던 말 말 밤의 우리를를
사라져 사라져 침묵 버린
아니 아니 의도 사실 마지막에에
넌 넌 있었어
혼자서 혼자서 날들
이제 이제 의미 다
아주 아주 떠나 멀리 싶어
아무 아무도 발걸음 않게
아주 아주 떠나 멀리있어
너 너 만났던를 때 그대로 그대로
언제 언제 였을까
하루 하루지나
더 더 곳 깊은 가두려 했었지 했었지
외로운 외로운 일상 내에
조금 조금 바랬어
긴 긴 끝이길 한숨도
혼자서 혼자서 날들
멀리서 멀리서 기억
이젠 이젠 의미 다 봐
아주 아주 떠나 멀리 싶어
아무 아무도 발걸음 않게
아주 아주 떠나 멀리있어
너 너 만났던를 때 그대로 그대로
조금씩 조금씩 무너져만 무너지고
아물 아물 상처은은로 스며든 위로로
모든 모든 흩어져 게 오늘이이
믿기지 믿기지 네 않아 없어진 하루 하루
너 너 어땠는지는 싶어
이런 이런가 내 보인대도
너 너 아무렇지는 걸까
멀어져 멀어져 버린가 일까",https://www.youtube.com/watch?v=8ebPs7hKrc4,"카더가든 Car, the garden - 그날,우리 Get To You Official M/V"
이고도 - Mouse,"여기요
긴 긴 요 고에
숨죽여 숨죽여 법있는 알고 알고 있지 않니
그 그을 방법에게도에게도 알려 줘
때 때되면가 모두
어디론가 어디론가 거잖아
난 난 분주 어쩌면 사람들 사람들 틈에
더 더있는 가만히을 배웠어 배웠어
오, 나는 죽은 척해야합니다
나는이 도시에있다
그리고 나는 밤을 겪고있다
오, 나는 숨을 참아야합니다
나는 사랑을 찾을 것이다
여기에서 살아남을 수있는 방법을 찾으십시오
모두 모두
지나가고
난 난에야 후 후를내어 소릴 내 내
안길 안길없는 품에는
얼룩이 얼룩이
때 때되면가 모두
어디론가 어디론가 거잖아
난 난 분주 어쩌면 사람들 사람들 틈에
더 더있는 가만히을 배웠어 배웠어
오, 나는 죽은 척해야합니다
나는이 도시에있다
그리고 나는 밤을 겪고있다
오, 나는 숨을 참아야합니다
나는 사랑을 찾을 것이다
여기에서 살아남을 수있는 방법을 찾으십시오
오, 나는 죽은 척해야합니다
나는이 도시에있다
그리고 나는 밤을 겪고있다
오, 나는 숨을 참아야합니다
나는 사랑을 찾을 것이다
여기에서 살아남을 수있는 방법을 찾으십시오
나 나 왜는 견디질 못해 못해
삐끗하다간 삐끗하다간 크게 더 텐 데 데
저길 저길 그림자 봐 흔들리잖아",https://www.youtube.com/watch?v=fLWuMf3ggHc,[Official Audio] 이고도 (Lee go do) - Mouse
박소은 - 너는 나의 문학,"너 너 어느는없는
소설가 소설가 문학의 문장
아니 아니 부족 그걸론
너 너 어느는없는
소설가 소설가 마지막의
안 안 이것 돼 부족한데한데
너 너 나는 수레바퀴 아래서 아래서
너 너 나는는 호밀 밭의 파수꾼 파수꾼
너 너 나는 헤밍웨이 요조 요조
나 나 너는는 나는 너를를
계속 계속 싶어
닳아 닳아 때 없어질
계속 계속 싶어
해져 해져 때 찢어질
계속 계속 싶어
닳아 닳아 때 없어질
계속 계속 싶어
해져 해져 때 찢어질
너 너 말의 시가되어되어
텅 텅 책 빈 받아 적히고 적히고
그걸 그걸 들고
다닐 다닐 야
너 너 노랜의이되어되어
내 내 속 눈 깊이 박히고 박히고
모두 모두를 너 될 될 거 야
너 너 나는 노르웨이 노르웨이의 숲
너 너 나는 데미안
너 너 나는는 설명 할 수없는 책 책
나 나 너는는 나는 너를를
계속 계속 싶어
닳아 닳아 때 없어질
계속 계속 싶어
해져 해져 때 찢어질
계속 계속 싶어
닳아 닳아 때 없어질
계속 계속 싶어
해져 해져 때 찢어질
계속 계속 싶어
달 달 넘어갈이까지
계속 계속 싶어
해 해 떨어질가까지
너 너 나는는 너는 나의 책 책
너 너 나는는 너는 나의 문학 문학
너 너 나는 마지막 문장 문장
너 너 나는는 너는 내 첫 문장 문장",https://www.youtube.com/watch?v=PhevISm-8-w,[온스테이지2.0] 박소은 - 너는 나의 문학
이강승 - 사랑이 너무 헤퍼,"사랑 사랑 너무이이 그 말을 못 했네 했네
말라붙은 말라붙은에 입은 아니고 아니고
스쳐진 스쳐진에 옷깃 인연이었는데이었는데
떠나가 떠나가 난 버리면해야 해 해
풀어진 풀어진 한가운데 마음 게
사랑 사랑 웃지이라이라 너는 바보일 거 야 야
얘길 얘길 내해도이 헤퍼 헤퍼
그게 그게 무시 어리석다
다들 다들 할 기억 야
사랑 사랑 아픈에에이 오늘을 덮칠 때 때
어쩔 어쩔 몰라서 줄 발걸음
가만히 가만히 이상보다 주변 주변을 살피니
겁 겁 먹은을을 나뿐이 아니네 아니네
풀어진 풀어진 한가운데 마음 게
사랑 사랑 웃지이라이라 너는 바보일 거 야 야
얘길 얘길 내해도이 헤퍼 헤퍼
그게 그게 무시 어리석다
다들 다들 할 기억 야
나는 당신이 당신을 더 많이 필요로합니다
당신이 거기에 있다면 당신은 내가 당신을 사랑한다는 것을 압니다
나는 당신이 당신을 더 많이 필요로합니다
당신이 거기에 있다면 당신은 내가 당신을 사랑한다는 것을 압니다
풀어진 풀어진 한가운데 마음 게
사랑 사랑 웃지이라이라 너는 바보일 거 야 야
얘길 얘길 내해도이 헤퍼 헤퍼
그게 그게 무시 어리석다
다들 다들 할 기억 야
나는 당신이 당신을 더 많이 필요로합니다
당신이 거기에 있다면 당신은 내가 당신을 사랑한다는 것을 압니다
나는 당신이 당신을 더 많이 필요로합니다
당신이 거기에 있다면 당신은 내가 당신을 사랑한다는 것을 압니다",https://www.youtube.com/watch?v=y1bxfrmfLi8,이강승 - 사랑이 너무 헤퍼 / 가사
김새녘 - 의심,"날 날 전 버리기
다시금 다시금 요
싫었던 싫었던을
한없이 한없이
당신 당신 거짓말의 말 말에도
미워 미워 않았어
아직 아직 더 날
감당 감당 수 할 것 같은 같은
내 내 이해 진심을 줘
지나친 지나친은
아련히 아련히
그 그 날 어떤
아픈 아픈 그때 건 텐 데 데
마지막 마지막 모습 그대의
미워 미워 수 할
아직 아직 마음 난
다 다 잊을 버리고없는
기억 기억을 속 요
거짓말
아직 아직
거짓말",https://www.youtube.com/watch?v=-IgyD-IH6cM,[Official Audio] 김새녘 (saeneok) - 의심 (doubt)
콜드 - 아무도 모르는 노래,"나 나 스쳐를 그대
내 내을 말 줘
걸음 걸음 멈추고
내 내 들어 노랠
그래 그래
텅 텅 거리 빈 불
날 날 비추면
무대 무대 시작를
나 나 여기 홀로
그래 그래
축 축 고개들 처진
비틀 비틀는 거리
그렇게 그렇게는 나이 돼 돼
아무도 아무도 아무도 예
노래 노래 부르며 예
텅 텅 거리 빈
채우는 채우는
난 난을 꿈
늘 늘을 꿈 꿈 예
아무도 아무도
노래 노래 부를래
지나가는 지나가는의
마음 마음 붙잡을을 있길 바라며 바라며",https://www.youtube.com/watch?v=NXMUTPOh2gw,A Song Nobody Knows (아무도 모르는 노래)
위수 - 교토,"이상 이상 만치 하리 하리 하늘 아래에 서서 서서
너 너 안고를
가진 가진이 것 것 것도 없지만
너 너 늘에게 해 해주고 싶어
살아야지
나 나 살아는에게
니가 니가 싶은 살고되어 줘야지 줘야지
험난 험난 세상 한
너 너 언제는 나
나 나 마음의 영원 영원 한 교토
언젠가 언젠가의 너을 잡고 잡고
다시 다시에 이곳 수 있을까 있을까
가진 가진이 것 것 것도 없어서
너 너는에게 말 못하고 못하고
그저 그저 수 안아줄 없어
슬픈 슬픈을 꿈 일어난 일어난 것처럼
너 너 잊어야만를 날이이
오지 오지를
슬픈 슬픈을 꿈 일어난 일어난 것처럼
너 너 잊어야만를 날이이
오지 오지를
살아야지
나 나 살아는에게
니가 니가 싶은 살고되어 줘야지 줘야지
험난 험난 세상 한
너 너 언제는 나
나 나 마음의 영원 영원 한 교토",https://www.youtube.com/watch?v=P-E3l-A62bc,"[가사] 위수, 교토 / 나는 살아 너에게 네가 살고 싶은 세상이 되어줘야지 (WISUE - Kyoto)"
리도어 - 사랑의 미학,"미리 미리
조금 조금 아팠을까
내 내를 하루 줄 줄 일기장에는
또 또을 무엇
부풀린 부풀린에 사랑 요
뒷걸음치는 뒷걸음치는 모습 내 요
내 내 나가 괴롭혔네 요 요
어둠이 어둠이 난 떨어져도
풍선 풍선 매달린에
해 해 떠오른다면
옅어진 옅어진를 우리 거예요예요
꽃잎은 꽃잎은해도
부풀린 부풀린에 사랑 요
뒷걸음치는 뒷걸음치는 모습 내 요
내 내 나가 괴롭혔네 요 요
어둠이 어둠이 난 떨어져도
떠내려간 떠내려간이 마음없이없이 찾아와 요
사라진 사라진 만 흔적한데
부풀린 부풀린에 사랑 요
뒷걸음치는 뒷걸음치는 모습 내 요
내 내 나가 괴롭혔네 요 요
그늘이 그늘이 난 떨어져도
난 난 번 세 빙글 돌아요 돌아요
어지러운 어지러운은 세상 요
사랑 사랑 말이란 몰라 요 요
후회 후회 삼켜봐야를 겠어 요 요",https://www.youtube.com/watch?v=0J9V1aNg4k0,리도어 (Redoor) -  사랑의 미학
Off the menu - Sunshine,"너 너 웃음의는
나 나들을 만있어서있어서 너무 좋아
너 너 나와는 닮아서
내 내 것 모든 모든 안 엔 네가있어있어
늦은 늦은 집 밤 돌아갈 때 때
벌써 벌써 얼굴 네 떠올라
아쉬움 아쉬움 네게에에 또 전화를 걸어 걸어
너 너 행운라는 있다는 게 게
어떤 어떤 그려지지가 단어로도
내가 당신의 마음을 찾을 때마다
내 내 내 속 마음 네가가 깊게 자리 잡고있어있어
나는 당신의 작은 손을 잡을 때마다
꽉 꽉 꽉이 잡은 손을을 꼭 놓지 않을 게 게
당신을 위한
당신을 위해
너 너 한에게 다가갈게
조금 조금어도 서툴 닿을테니까테니까
모른척 모른척 말아하지
투명 투명 세상 한 한 유일 한 선물은 너야 너야
내가 당신의 마음을 찾을 때마다
내 내 내 속 마음 네가가 깊게 자리 잡고있어있어
나는 당신의 작은 손을 잡을 때마다
꽉 꽉 꽉이 잡은 손을을 꼭 놓지 않을 게 게
당신을 위한
내가 당신의 마음을 찾을 때마다
나는 당신의 작은 손을 잡을 때마다",https://www.youtube.com/watch?v=OZkyGJD5it8,Sunshine
백예린 - Antifreeze,"우린 우린부터 오래전 오래전 수없는 거 였어 였어
우주 우주을 속 떠돌며 떠돌며 많이 외로워하다가
어느 어느 태양과 순간 순간이 겹치게 될 때면면
모든 모든을 것 것 할 수있을 거 야 야

하늘 하늘 비 에선 내렸어
뼈 뼈까지 속 젖었어
얼마 얼마 비있다 그쳤어
대신 대신 내리더니
영화서도 영화서도 수 볼 볼 눈 보라가 불 때 때
너 너 내는 처음 처음 봤던 눈동자야

낯익은 낯익은이 거리들처럼 반짝여도 반짝여도
니가 니가주는 건네 건네 위에 살얼음이 떠도 떠도
우리 우리 얼어붙지 둘은 거 야 야
바다 바다 모래 속의 녹일 녹일 거 야
춤 춤 추며을을 이랑 싸울 거 야 야
얼어붙은 얼어붙은 도시 아스팔트로

숨이 숨이 거 막힐 막힐 차가웠던 공기 속에에
너 너 체온의의 내 게 스며들어오고있어있어
우리 우리 얼어붙지 둘은 거 야 야
바다 바다 모래 속의 녹일 녹일 거 야
춤 춤 추며을을 이랑 싸울 거 야 야
얼어붙은 얼어붙은 도시 아스팔트로


너 너 나와와 세대가 마지막이면 어떡 해 해
또 또 빙하기 다른 찾아오면 찾아오면 어떡 해
긴 긴에 세월 세월 않을 그런 사랑은 없겠지만 없겠지만
그 그 그을 사랑 그런 사람 사람을 찾는 거 야 야
긴 긴에 세월 세월 않을 그런 사랑은 없겠지만 없겠지만
그 그 그을 사랑 그런 사람 사람을 찾는 거 야 야

긴 긴에 세월 세월 않을 그런 사랑은 없겠지만 없겠지만
그 그 그을 사랑 그런 사람 사람을 찾는 거 야 야
긴 긴에 세월 세월 않을 그런 사랑은 없겠지만 없겠지만
그 그 그을 사랑 그런 사람 사람을 찾는 거 야 야",https://www.youtube.com/watch?v=74_yqNBhQbA,백예린 (Yerin Baek) 'Antifreeze' Lyric Video
나이트오프 - 잠,"점점 점점 골목 좁아지던
막힌 막힌에 끝
외투 외투의 위를를 털다 웃었어
벽 벽 기대어에 짐을 내려놓으니 내려놓으니
한 한의 줌이이 그토록 무거웠구나
탓 탓 무언가 할 애써 떠올려봐도 떠올려봐도
오직 오직의 나만뿐 이었네 이었네
나 나 누우면 조금 될까
잠깐 잠깐 안 잠들면
날도 날도
아무도 아무도
나 나 누우면 조금 될까
이대로 이대로 안 잠들면
따뜻한 따뜻한 속 꿈
조금 조금 올 쉬고 야
많은 많은 달라지고
변하고 변하고 가고
애써 애써 온 감춰의의 지친 마음도
더 더 필요는 자존심 자존심을 내려놓으니
이젠 이젠 자신 나 가엾어 가엾어해도 되겠지
탓 탓 무언가 할 애써 떠올려봐도 떠올려봐도
오직 오직의 나만뿐 이었네 이었네
나 나 누우면 조금 될까
잠깐 잠깐 안 잠들면
날도 날도
아무도 아무도
나 나 누우면 조금 될까
이대로 이대로 안 잠들면
따뜻한 따뜻한 속 꿈
못다한 못다한와 악수를 나누며 나누며
이제 이제 뭘와 고
웃으며 웃으며
모두 모두 싶다
나 나 누우면 조금 될까
잠깐 잠깐 안 잠들면
날도 날도
아무도 아무도
나 나 누우면 조금 될까
이대로 이대로 안 잠들면
따뜻한 따뜻한 속 꿈
조금 조금 올 쉬고 야",https://www.youtube.com/watch?v=x-k8gL_r__U,[MV] 나이트오프(Night Off) - 잠(Sleep) / Official Music Video
이희상 - 애열,"걱정 걱정 마
우린 우린 할 영원
네 네에 곁
언제나 언제나 같아
사라지지마
서로 서로 미워진대도
네 네에 옆
언제나 언제나이야
결국 결국 변하고야 우린
금세 금세은 사랑 잊혀져가고
영원 영원 거 할 말 말에 끄덕이던
그 그 우리 시절 시절 감정은 떠나가고 어디에에
떠내려가네 떠내려가네 사랑
내 내에 곁 줘
그대가 그대가
기억 기억 거 할 영원히
모든 모든 잊혀진대도
결국 결국 변하고야 우린
금세 금세은 사랑 잊혀져가고
영원 영원 거 할 말 말에 끄덕이던
그 그 우리 시절 시절 감정은 떠나가고 어디에에
떠내려가네 떠내려가네 사랑
내 내에 곁 줘
그대가 그대가
기억 기억 거 할 영원히
모든 모든 잊혀진대도",https://www.youtube.com/watch?v=F1QF4wOQhjE,[MV] 이희상 (LEEHEESANG) - 애열 (Love Shine) / Official Music Video
혁오 - Love Ya!,"두려워하지 마세요
우리 담요를 차기 풍선 만듭니다
내부에 숨어 있습니다
나는 내 사랑을 당신의 입술에 날려 버릴 것입니다
이 조용한 순간을 사랑하십시오
당신은 누굴 구할 것입니까
최고의 친구라면
그리고 나는 익사하고있다
친구를 구할 것입니다
당신은 스님 물개와 같기 때문입니다
그리고 당신은 물었다
사랑해요
당신은 나를 얼마나 사랑할 수 있습니까?
emm 그냥
천 단어없이
그리고 나는 말할 것입니다
나는 사랑해 사랑해
나는 사랑해 사랑해
두려워하지 마세요
당신의 작은 지점을 숨기십시오
내 반지 손가락으로
이름을 넣으겠습니다
당신의 각각
모든 머리카락
이 조용한 순간을 사랑하십시오
당신은 누굴 구할 것입니까
최고의 친구라면
그리고 나는 익사하고있다
친구를 구할 것입니다
당신은 스님 물개와 같기 때문입니다
당신은 나와 같습니다
그리고 나는 당신과 같습니다
지금 생각하는 것
항상 나와 동일합니다
그래서 내가 사랑에 빠진 이유입니다
나는 사랑해 사랑해
나는 사랑해 사랑해
나는 사랑해 사랑해
나는 사랑해 사랑해
나는 사랑해 사랑해
나는 사랑해",https://www.youtube.com/watch?v=aKHbqm-D62Y,HYUKOH(혁오) - LOVE YA! M/V
검정치마 - 나랑 아니면,"야 야 놀자 나랑까지
함께 함께 치면서
나랑 나랑 너 마셔 나의의
몸 몸 녹아이
나랑 나랑 저 걷자까지
가다 가다 누우면
나랑 나랑 두 자자 꼭 감고 감고
나랑 나랑 맞추자
나랑 나랑 누구 아니면
사랑 사랑 수 할
나랑 나랑 어디 아니면
자랑 자랑 수 할
나랑 나랑
야 야 놀자 나랑 가지 말고 말고
그리울 그리울 없도록
나랑 나랑 아주 살자
우리 우리 살자
나랑 나랑 누구 아니면
사랑 사랑 수 할
나랑 나랑 어디 아니면
자랑 자랑 수 할
나랑 나랑
아무렇지 아무렇지 넌 않게 게 게 말 했지
날 날 죽을 위해 위해 죽일 수도있다 고 고
알아 알아도 나
같은 같은이야이야 베이비
아마도 아마도 오래
아주 아주 함께 오래 거 야 야",https://www.youtube.com/watch?v=0dRo5Kbgx6c,[MV] 검정치마(The Black Skirts) - 나랑 아니면(Who Do You Love)
N@di - 편지,"달 달 뜰이
두 두 지나고 밤
우리 우리 하자던
약속 약속 두 있고이이지나 요
우리 우리 다 둘 쓰러진 쓰러진 날 엔
작은 작은에서 눈밭 또 웃다가 웃다가
내일 내일 않아서 같지 요
아 아
우산 우산 막이 날에는에는
바깥 바깥 풍경의
나 나 재우는를를 방안을 다 적시지만 적시지만
나 나 나 아직는입니다 채 채 말을 다 못한 못한
눈물들로 눈물들로 그대 함께 안고 안고 싶어 요
아아 아아 해 사랑
느리던 느리던을 밤 웃고
그렇게 그렇게 저녁들 잠드는지나
우리 우리 해 기억 지난날들 지난날들까지도
사랑 사랑 걸 인 인 나에게와 줘 요 요
아아 아아 해 사랑
느리던 느리던을
같이 같이 그렇게 웃고 저녁들 저녁들을지나
우리 우리 해 기억 지난날들 지난날들까지도
사랑 사랑 걸 인 인 나에게와 줘 요 요",https://www.youtube.com/watch?v=SfzPdG3hN7Y,[MV] n@di - 편지 (Letter)
"다섯 - ,","하나! 셋! 둘!넷! 다섯!

다섯 다섯
아기 아기
연못 연못 놀러에 요.
엄마 엄마
꽥, 꽥, 꽥, 꽥
네 네 만 오리 왔어 요 요.

하나! 셋! 둘!넷!

네마리
아기 아기.
연못 연못 놀러에 요.
엄마 엄마.
꽥, 꽥, 꽥, 꽥
세 세 만 오리 왔어 요 요.

하나! 셋! 둘!

세 세
아기 아기
연못 연못 놀러에 요
엄마 엄마
꽥, 꽥, 꽥, 꽥
두 두 만 오리 왔어 요 요.

하나! 둘!

두 두
아기 아기
연못 연못 놀러에 요
엄마 엄마
꽥, 꽥, 꽥, 꽥
한 한 만 오리 왔어 요 요.
하나!

한마리
아기 아기
연못 연못 놀러에 요
엄마 엄마
꽥, 꽥, 꽥, 꽥
아무도 아무도 않아 돌아오지.

엄마 엄마
펑펑 펑펑 요
아기 아기 사라 오리 요
아빠 아빠
꽥, 꽥, 꽥, 꽥
다섯 다섯 돌아 오리 요",https://www.youtube.com/watch?v=FSrselRd1ws,💿𝗙𝗨𝗟𝗟▸ 다섯 노래모음 | Dasutt songs playlist
정우물 - blue,"순수 순수 그 했었던 엔
어떤 어떤 만 색깔 특별했던했던
그런 그런를 나 참 참 슬퍼 요
외로움도 외로움도 그 많았던
지금 지금 해 생각 순진했고했고
그런 그런를 나 참 참 슬퍼 요
서서히 서서히는 나
아무도 아무도 조용히 모르게
처음 처음 그 헤어졌었던도
점점 점점 가며 무뎌져없는
그런 그런를 나 참 참 슬퍼 요
서서히 서서히는 나
아무도 아무도 조용히 모르게
서서히 서서히를 나 주면
다시 다시 나 밝게비추는 보며 웃고 웃고",https://www.youtube.com/watch?v=pvhr7ofYE9c,정우물(jungumul) - blue
wave to earth - seasons,"나는 당신의 사랑이 될 수 없습니다
지금 당신에게는 너무 사소한 것 같습니다
오, 내 인생은 무너지고 있습니다
내가 사라지면 아무도 알지 못할 것입니다
그러나 나는 항상 당신을 위해기도 할 것입니다
내가 당신 옆에있을 수 있다면
내 시즌 내 평생을 줄 것입니다
나는 당신의 사랑이 될 수 없습니다
당신의 삶을 망칠 까봐 두려워
잎이 시들어 버렸을 때
그리고 다시 자랐습니다. 당신은 멀리갔습니다
나는 데이지를 밀어 올릴 것이다
그리고 여기에 모든 기회를 가져 오십시오
그러나 나는 항상 당신을 위해기도 할 것입니다
내가 당신 옆에있을 수 있다면
내 시즌 내 평생을 줄 것입니다
당신 옆에 나는 당신의 계절이 될 것입니다
나의 사랑",https://www.youtube.com/watch?v=nZqwQCLYgjk,[온스테이지2.0] wave to earth - seasons
The 1975 - About You,"나는 장소를 알고있다
내가가는 곳입니다
당신의 얼굴을 기억해야 할 때
우리는 머리 속에서 결혼합니다
우리가 시도하는 동안해야 할 일
우리가 어떻게 만났는지 기억하십시오
내가 잊어 버린 것 같아?
내가 잊어 버린 것 같아?
내가 잊었다고 생각하니?
당신에 대해?
당신과 나 (놓지 마)
우리는 살아있다 (놓지 마)
할 수있는 일은없이 할 수 있습니다
누워서 눈을 바라보세요
잠깐 (놓지 마)
그리고 척하십시오 (놓지 마십시오)
붙잡고 희망합니다
우리는 결국 우리의 길을 찾을 것입니다
내가 잊어 버린 것 같아?
내가 잊혀진 것 같아?
내가 잊었다고 생각하니?
당신에 대해?
내가 잊혀진 것 같아?
내가 잊어 버린 것 같아?
내가 잊었다고 생각하니?
당신에 대해?
당신에 대해 뭔가가있었습니다
지금은 기억할 수 없습니다
그것은 똑같은 빌어 먹을 것입니다
내 마음이 항복했다
그리고 기차에서 당신을 그리워 할게요
아침에 당신이 그리워요
나는 무엇에 대해 생각 해야할지 전혀 모른다
나는 당신에 대해 생각합니다
당신에 대해
당신은 생각하십니까?
나는 당신에 대해 잊었습니까?
당신에 대해
당신에 대해
당신은 생각하십니까?
나는 당신에 대해 잊었습니까?
당신에 대해",https://www.youtube.com/watch?v=tGv7CUutzqU,The 1975 - About You
예빛 - 소낙비,"하얀 하얀이 꽃 날 엔 엔
어김없이 어김없이를 나 요
이이도 밤 밤 달도지는 날 엔 엔
맘 맘 자꾸이로가요가요
훗날 훗날 비 궂은 내려와도
나 나 그는에에있어 요
아무도 아무도 않는 찾지에서
멍하니 멍하니 만 하늘 요
훗날 훗날 비 검은 내려와도
내 내 절대 맘 않아 요 요
아무도 아무도 않는 찾지를 따라 따라
애꿎은 애꿎은 만 비",https://www.youtube.com/watch?v=ABR18FwIBlc,소낙비 (SONAKBI) (자작곡 Original)
